{"datasetId":"abecean-shores-26.09","locale":"en","places":[{"aliases":[],"name":"Fort Heath, Miners Quarters","placeId":"abecean-shores-26.09.place-00b7a023224666c8b04b"},{"aliases":[],"name":"Harkisius Barrow","placeId":"abecean-shores-26.09.place-00f44a34b5f54375e1f5"},{"aliases":[],"name":"Anvil, Temple of Dibella Estetica: Sacred Workshops","placeId":"abecean-shores-26.09.place-0263c1ee2053dec3ce2d"},{"aliases":[],"name":"White Reef","placeId":"abecean-shores-26.09.place-028cd5c441af95fa4938"},{"aliases":[],"name":"Archad, Beran Volurian's House","placeId":"abecean-shores-26.09.place-031e8d6ba8b226f356a5"},{"aliases":[],"name":"Fort Telodrach","placeId":"abecean-shores-26.09.place-03a581770ddb969968d7"},{"aliases":[],"name":"Archad, Kathrelor: General Goods","placeId":"abecean-shores-26.09.place-04d8057b9c73146af90f"},{"aliases":[],"name":"Elendroth's House","placeId":"abecean-shores-26.09.place-054968b60631d10d3264"},{"aliases":[],"name":"Hal Sadek, Nolhu's House","placeId":"abecean-shores-26.09.place-057120bec88cb89fc85e"},{"aliases":[],"name":"Thresvy, Thin-Thread's House","placeId":"abecean-shores-26.09.place-0624d1e704e90eb5f07b"},{"aliases":[],"name":"Blue Raven: Hold","placeId":"abecean-shores-26.09.place-06f4bb0fb0333b0adbc8"},{"aliases":[],"name":"Axilas Grotto","placeId":"abecean-shores-26.09.place-0779bed7e20e9f8a31ae"},{"aliases":[],"name":"Goldstone, Grand Foyer","placeId":"abecean-shores-26.09.place-07ff4b45e5650f278dfa"},{"aliases":[],"name":"Hearthrend: Hold","placeId":"abecean-shores-26.09.place-08ea158620360af53eb0"},{"aliases":[],"name":"Thresvy, Lacorius Estate: Merania Chaldrava's House","placeId":"abecean-shores-26.09.place-097c426367b8932e5b34"},{"aliases":[],"name":"Salthearth, Farmhands' Lodge","placeId":"abecean-shores-26.09.place-09e8ffb540be7332fd7c"},{"aliases":[],"name":"Lacorius Crypt","placeId":"abecean-shores-26.09.place-0a3760a5e8454ee26574"},{"aliases":[],"name":"Brine Stone: Hold","placeId":"abecean-shores-26.09.place-0d87249e89084ac8eca7"},{"aliases":[],"name":"Mischarstette","placeId":"abecean-shores-26.09.place-0e15bbc2db6e427958d4"},{"aliases":[],"name":"Marav","placeId":"abecean-shores-26.09.place-0f74a4b33821ef178699"},{"aliases":[],"name":"Mykoi Lighthouse","placeId":"abecean-shores-26.09.place-104a8c0e351d3f9f17b6"},{"aliases":[],"name":"Sinalon","placeId":"abecean-shores-26.09.place-11bfe43af323dee67eff"},{"aliases":[],"name":"Charach, Docks Storage","placeId":"abecean-shores-26.09.place-132cc6357c198761caa7"},{"aliases":[],"name":"Saint Emmelia: Cabin","placeId":"abecean-shores-26.09.place-134a2c6da4a40af14e1d"},{"aliases":[],"name":"Anvil, Rahula: Master Fletcher","placeId":"abecean-shores-26.09.place-137f26145393897a032b"},{"aliases":[],"name":"Anvil, Orius Triso: General Goods","placeId":"abecean-shores-26.09.place-1567e200591f088e822c"},{"aliases":[],"name":"Beldaburo","placeId":"abecean-shores-26.09.place-15d645c50647c94d0b88"},{"aliases":[],"name":"Fort Telodrach, Auxiliary Tower","placeId":"abecean-shores-26.09.place-17833354dc4793bb4105"},{"aliases":[],"name":"Thresvy, Chapel of Persisting Sustenance","placeId":"abecean-shores-26.09.place-17bec0d0300a301555bd"},{"aliases":[],"name":"Ogima","placeId":"abecean-shores-26.09.place-181756eeb34062c6aa75"},{"aliases":[],"name":"Anvil, Arina Fontia's Apartment","placeId":"abecean-shores-26.09.place-198cb7e83208a3b1cc35"},{"aliases":[],"name":"Karrel: Hold","placeId":"abecean-shores-26.09.place-19cb34d6bc2d40f3ae9d"},{"aliases":[],"name":"Anvil, Thirroth: Alchemical Remedies","placeId":"abecean-shores-26.09.place-1a43ff0c4a40071e352d"},{"aliases":[],"name":"Agi Bay Grotto","placeId":"abecean-shores-26.09.place-1ab228360f1fbdbed148"},{"aliases":[],"name":"Charach, Nayad Irune's House","placeId":"abecean-shores-26.09.place-1b8c06c7417b119f5eaa"},{"aliases":[],"name":"Relds Farm, Chaney's House","placeId":"abecean-shores-26.09.place-1c2db2615a08d13e29bd"},{"aliases":[],"name":"Einluk Mine","placeId":"abecean-shores-26.09.place-1cdf727bfecaa32766e1"},{"aliases":[],"name":"Brina Cross, South Guard Towers","placeId":"abecean-shores-26.09.place-1de938c060d312bba93b"},{"aliases":[],"name":"Pyraeus","placeId":"abecean-shores-26.09.place-1dfc79580e9c74f08696"},{"aliases":[],"name":"Val Ansvech Barrow","placeId":"abecean-shores-26.09.place-1e9646312640a4d7e0c6"},{"aliases":[],"name":"TEM Sunset Sword: Cabin","placeId":"abecean-shores-26.09.place-1f4e91c09a2cb78885ca"},{"aliases":[],"name":"Benirus Crypt","placeId":"abecean-shores-26.09.place-1f7d05596376e38fb2de"},{"aliases":[],"name":"Anvil, Temple of Dibella Estetica: Antechamber","placeId":"abecean-shores-26.09.place-1f8a5765560ead76dc72"},{"aliases":[],"name":"Nabor","placeId":"abecean-shores-26.09.place-1f9a34ced6ff7be115f2"},{"aliases":[],"name":"Archad, Durokh gro-Bakush's House","placeId":"abecean-shores-26.09.place-20083df5491d19988de5"},{"aliases":[],"name":"Saltgrass Poet","placeId":"abecean-shores-26.09.place-207c6039e037172fb0c8"},{"aliases":[],"name":"Old Thraswatch, Abandoned Cellar","placeId":"abecean-shores-26.09.place-23ae7ae21a890d51cb98"},{"aliases":[],"name":"Beccha Barrow","placeId":"abecean-shores-26.09.place-23c29b438c1603067bf8"},{"aliases":[],"name":"Anvil, Temple of the First Breath","placeId":"abecean-shores-26.09.place-23ee9bdf4684be1a3bbb"},{"aliases":[],"name":"Hal Sadek, Stavius Tantius' House","placeId":"abecean-shores-26.09.place-24af74203382fb7526d4"},{"aliases":[],"name":"Emperor Cassynder: Cabin","placeId":"abecean-shores-26.09.place-24c1e1e03861d5a0df3e"},{"aliases":[],"name":"Brina Cross, Nais Hearth-Eye's House","placeId":"abecean-shores-26.09.place-25421ed69fc1f3dacb5e"},{"aliases":[],"name":"Anvil, The Abecette: Hotel","placeId":"abecean-shores-26.09.place-258f3810a5ee0e926558"},{"aliases":[],"name":"Brina Cross, Medericus Distillery","placeId":"abecean-shores-26.09.place-269e287e8a45587730ef"},{"aliases":[],"name":"Charach, Auderic Romaud: Apothecary","placeId":"abecean-shores-26.09.place-2783be4beb34e717c790"},{"aliases":[],"name":"Anvil, Temple of Dibella Estetica: Auditorium","placeId":"abecean-shores-26.09.place-27b8d4011a1342462764"},{"aliases":[],"name":"Thresvy, Vadich Residence","placeId":"abecean-shores-26.09.place-27fe34d0ec8d62cbc4e0"},{"aliases":[],"name":"Anvil, North Wall Apartments","placeId":"abecean-shores-26.09.place-2a24a52a80a3f6c190e4"},{"aliases":[],"name":"Anvil, Conservatory of Saint Laeca","placeId":"abecean-shores-26.09.place-2a57827f8531dfb756cc"},{"aliases":[],"name":"Goldstone, Dungeons","placeId":"abecean-shores-26.09.place-2b6c2f7c21f25a1d853d"},{"aliases":[],"name":"Charach, Ugenring's House","placeId":"abecean-shores-26.09.place-2c2413838b56275691bf"},{"aliases":[],"name":"Anvil, Five Fathoms Flophouse","placeId":"abecean-shores-26.09.place-2cc2fd723d25e34885f3"},{"aliases":[],"name":"Fort Heath, Gate Tower","placeId":"abecean-shores-26.09.place-2e0ecca1f86bbe6a4956"},{"aliases":[],"name":"Archad, Cerdia Baraci's House","placeId":"abecean-shores-26.09.place-2e3fbfb3ac91368f33a0"},{"aliases":[],"name":"Talgiana Orchard, Stanius Residence","placeId":"abecean-shores-26.09.place-2e945e32782602c33651"},{"aliases":[],"name":"Anvil, Beacon Company","placeId":"abecean-shores-26.09.place-2f39782d76dbbd1c9af1"},{"aliases":[],"name":"Fort Heath","placeId":"abecean-shores-26.09.place-2fab971a3f989edf408c"},{"aliases":[],"name":"Vitta Barrow","placeId":"abecean-shores-26.09.place-305b7fd25dbbe382270e"},{"aliases":[],"name":"Anvil, Imperial Geographical Society","placeId":"abecean-shores-26.09.place-32b7eccec75c709dd2dd"},{"aliases":[],"name":"Anvil, Abecean Trading Company Warehouse","placeId":"abecean-shores-26.09.place-3350f9ecd76d27bd102c"},{"aliases":[],"name":"Brina Cross, Granary","placeId":"abecean-shores-26.09.place-33866bb1c8231bd1f671"},{"aliases":[],"name":"Olive Ridley: Cabin","placeId":"abecean-shores-26.09.place-342366e21fc6e6565deb"},{"aliases":[],"name":"Mwezi","placeId":"abecean-shores-26.09.place-34bcfc228f178a08982c"},{"aliases":[],"name":"Karam's House","placeId":"abecean-shores-26.09.place-35b2804b8922d151d4d9"},{"aliases":[],"name":"Anvil, Imperial Astrological Society","placeId":"abecean-shores-26.09.place-35f43f363f855aa79902"},{"aliases":[],"name":"Talgiana Orchard, Manor","placeId":"abecean-shores-26.09.place-389fcda4358eee7c4232"},{"aliases":[],"name":"Oleta","placeId":"abecean-shores-26.09.place-39b9d8423fe8d6c481d2"},{"aliases":[],"name":"Anvil, Hasi Manor","placeId":"abecean-shores-26.09.place-3a12f7e78fcd92431f4e"},{"aliases":[],"name":"Wavemoth Legion Fort, Lighthouse","placeId":"abecean-shores-26.09.place-3a5515e88de33c662b6b"},{"aliases":[],"name":"Marav, Valcha Farmhouse","placeId":"abecean-shores-26.09.place-3ab679626db7141b690b"},{"aliases":[],"name":"TEM Eye of the Abecean: Hold","placeId":"abecean-shores-26.09.place-3afd69bd65ad67092ba9"},{"aliases":[],"name":"Goldstone, Royal Chambers","placeId":"abecean-shores-26.09.place-3b90efc7128040c14a81"},{"aliases":[],"name":"Corcaran Aster: Cabin","placeId":"abecean-shores-26.09.place-3cb02b606c33c5d0a5e9"},{"aliases":[],"name":"Marav, Barn","placeId":"abecean-shores-26.09.place-3da4894b38e5a9565ade"},{"aliases":[],"name":"Anvil, Bazaar of the Abecean","placeId":"abecean-shores-26.09.place-3df704d8f155a192a848"},{"aliases":[],"name":"Anvil, Navy Officer Lodgings","placeId":"abecean-shores-26.09.place-3ecca354d692f26356ef"},{"aliases":[],"name":"TEM Red Tempest: Cabin","placeId":"abecean-shores-26.09.place-3f92033c565cb5f42896"},{"aliases":[],"name":"Maitarra Grotto","placeId":"abecean-shores-26.09.place-421c37143bc6ecaa415c"},{"aliases":[],"name":"Wormusoel, Secret Passage","placeId":"abecean-shores-26.09.place-42d6bd45193a3c2873ee"},{"aliases":[],"name":"Charach","placeId":"abecean-shores-26.09.place-4317d69177383d065d2c"},{"aliases":[],"name":"Brina Cross","placeId":"abecean-shores-26.09.place-433013e541ae557dc91d"},{"aliases":[],"name":"Conomorus Crypt","placeId":"abecean-shores-26.09.place-435af4b56a5422538d1c"},{"aliases":